{
  "conformanceEvidenceId": "aecl_phase5_conformance_caf68c28c83a941a2781f16cd0ef72c74da447f3ee84cc78896d3fef92630d9e",
  "conformanceEvidenceHash": "0xcaf68c28c83a941a2781f16cd0ef72c74da447f3ee84cc78896d3fef92630d9e",
  "phase": "PHASE_5",
  "result": "PASS",
  "providerCount": 5,
  "commonSpiOperationCount": 9,
  "spiContractHash": "0x2188e312a9c682d4c72c23454cadff59aadd79e5175d8ee4adea0aaf58de8326",
  "adapterSetHash": "0x49483c0e48e45d464cf77b7d52177eea0ef832bf5a5b058e0587903fbf03c5b5",
  "referenceProviders": [
    {
      "adapterId": "base_account_spend_permission_reference",
      "providerFamily": "base_account",
      "architectureCategory": "native_smart_account_spend_permission",
      "descriptorHash": "0xab3b6092acf3be7789a329d634732a5de8cba4ba88bb04cbb2193c544db14d14",
      "capabilitiesHash": "0xca7904485189fdb94884a4b95cfd0cb81759a02bb91d06076fd4c21a9f15f909",
      "referenceReceiptHash": "0x034aaefb4260bd58b7693b066b93f2e4c0b9dfd4dd22386c26f616f5756f0f62",
      "referenceDecision": "QUARANTINE",
      "operationCount": 9,
      "independentlyDisabled": true,
      "externalCallsEnabled": false,
      "unsupportedCapabilitiesFailClosed": true,
      "externalPermissionWideningAllowed": false,
      "providerSecurityDataNormalized": true,
      "secondAuthorizationKernelCreated": false,
      "secondEconomicKernelCreated": false,
      "canonicalKernelChanged": false,
      "rawSecretsRetained": false,
      "productionAuthority": false,
      "fundsAuthority": false
    },
    {
      "adapterId": "circle_managed_agent_wallet_reference",
      "providerFamily": "circle_developer_controlled_wallets",
      "architectureCategory": "managed_mpc_wallet",
      "descriptorHash": "0x40cd0682b1215088c6d86ce6f93a3a36276e38e24f4585a3cbe868cc6e20fa8c",
      "capabilitiesHash": "0xc16155cc17cfc83f66f5ef7bc8b3c3af03dbd6feb06d237a027575fdc68ddc53",
      "referenceReceiptHash": "0x7b2bc6432992257ca0889cc86e2bda7633961daccf26ba168723bbcb10bdaeaa",
      "referenceDecision": "QUARANTINE",
      "operationCount": 9,
      "independentlyDisabled": true,
      "externalCallsEnabled": false,
      "unsupportedCapabilitiesFailClosed": true,
      "externalPermissionWideningAllowed": false,
      "providerSecurityDataNormalized": true,
      "secondAuthorizationKernelCreated": false,
      "secondEconomicKernelCreated": false,
      "canonicalKernelChanged": false,
      "rawSecretsRetained": false,
      "productionAuthority": false,
      "fundsAuthority": false
    },
    {
      "adapterId": "metamask_agent_wallet_reference",
      "providerFamily": "metamask",
      "architectureCategory": "browser_advanced_permission_wallet",
      "descriptorHash": "0x9b08c946f315ededa411c95ff7a3e36e71ac126d242c1266e1a905b04d0e6b81",
      "capabilitiesHash": "0x3f17cdbf9d173e71cde58bac40f2127e28163a6f6372b40228045ae5be4f458a",
      "referenceReceiptHash": "0xb4289abb8af7892f5bcd879afaaed1cc852a752bc22d1baa396fecdb0b1cc834",
      "referenceDecision": "QUARANTINE",
      "operationCount": 9,
      "independentlyDisabled": true,
      "externalCallsEnabled": false,
      "unsupportedCapabilitiesFailClosed": true,
      "externalPermissionWideningAllowed": false,
      "providerSecurityDataNormalized": true,
      "secondAuthorizationKernelCreated": false,
      "secondEconomicKernelCreated": false,
      "canonicalKernelChanged": false,
      "rawSecretsRetained": false,
      "productionAuthority": false,
      "fundsAuthority": false
    },
    {
      "adapterId": "okx_agentic_wallet_reference",
      "providerFamily": "okx_onchain_os",
      "architectureCategory": "wallet_cli_mcp_tee_reference",
      "descriptorHash": "0xa31a6b30fff166c638f2de4f4953161fd38d2f082d6bcbd614e3a68e8a82f02f",
      "capabilitiesHash": "0xeb41c2667cce4111df5dd51543a48ade8d8ca59c85d421bc0807b9103cce7de3",
      "referenceReceiptHash": "0x7a6be7c83d9668ee00b62f6ec4fb81bd0c6b212e09efa1007cf18cfdac2ecdf3",
      "referenceDecision": "QUARANTINE",
      "operationCount": 9,
      "independentlyDisabled": true,
      "externalCallsEnabled": false,
      "unsupportedCapabilitiesFailClosed": true,
      "externalPermissionWideningAllowed": false,
      "providerSecurityDataNormalized": true,
      "secondAuthorizationKernelCreated": false,
      "secondEconomicKernelCreated": false,
      "canonicalKernelChanged": false,
      "rawSecretsRetained": false,
      "productionAuthority": false,
      "fundsAuthority": false
    },
    {
      "adapterId": "safe_institutional_wallet_reference",
      "providerFamily": "safe",
      "architectureCategory": "institutional_multisig_smart_account",
      "descriptorHash": "0x21ce63c18d14190f6939876b998d167b1bb78a6d44168ea7ed182105d2532c9d",
      "capabilitiesHash": "0xa01bb391b3206641c0c05aca94c8c4be09676e0e48da8279b72f0dccc12bbbc7",
      "referenceReceiptHash": "0x4d4e766cf332ea672a069fb14fac625d6d952d05c10d11dbed6dc4516fd5accc",
      "referenceDecision": "QUARANTINE",
      "operationCount": 9,
      "independentlyDisabled": true,
      "externalCallsEnabled": false,
      "unsupportedCapabilitiesFailClosed": true,
      "externalPermissionWideningAllowed": false,
      "providerSecurityDataNormalized": true,
      "secondAuthorizationKernelCreated": false,
      "secondEconomicKernelCreated": false,
      "canonicalKernelChanged": false,
      "rawSecretsRetained": false,
      "productionAuthority": false,
      "fundsAuthority": false
    }
  ],
  "commonAeclSemanticsProviderNeutral": true,
  "unsupportedCapabilitiesFailClosed": true,
  "externalPermissionsNarrowOnly": true,
  "providerSecurityDataNormalized": true,
  "adaptersIndependentlyDisableable": true,
  "secondAuthorizationKernelCreated": false,
  "secondEconomicKernelCreated": false,
  "canonicalKernelChanged": false,
  "futureProviderRequiresKernelChange": false,
  "futureProviderPrimaryWork": "adapter_and_conformance",
  "safeTestnetWorkDeferred": true,
  "externalCallPerformed": false,
  "transactionSubmissionPerformed": false,
  "productionAuthority": false,
  "fundsAuthority": false,
  "observedAt": "2026-08-10T18:00:00.000Z",
  "expiresAt": "2026-08-10T18:05:00.000Z",
  "schemaVersion": "aecl_phase5_multi_provider_conformance_evidence.v1"
}
